{
  "upts_version": "1.0.0",
  "language": "rust",
  "variants": [
    ".rs"
  ],
  "metadata": {
    "author": "auto-generated",
    "created": "2026-01-29",
    "description": "RUST parser spec - generated from actual parser output"
  },
  "config": {
    "line_tolerance": 2,
    "require_all_symbols": true,
    "allow_extra_symbols": true,
    "validate_parent": true,
    "validate_evidence": true
  },
  "fixture": {
    "type": "file",
    "path": "../fixtures/rust_test_fixture.rs",
    "sha256": "a7afc3f22c5195f8f72fe6973c847c68b2ea55c31cb472e6184d46b30d619de0"
  },
  "expected": {
    "symbol_count": {
      "min": 27,
      "max": 42
    },
    "symbols": [
      {
        "name": "MAX_RETRIES",
        "type": "constant",
        "line": 7,
        "exported": true,
        "value": "3"
      },
      {
        "name": "DEFAULT_TIMEOUT",
        "type": "constant",
        "line": 8,
        "exported": true,
        "value": "30"
      },
      {
        "name": "INTERNAL_BUFFER_SIZE",
        "type": "constant",
        "line": 9,
        "exported": false,
        "value": "1024"
      },
      {
        "name": "UserId",
        "type": "type",
        "line": 13,
        "exported": true
      },
      {
        "name": "ItemList",
        "type": "type",
        "line": 14,
        "exported": true
      },
      {
        "name": "Repository",
        "type": "trait",
        "line": 18,
        "exported": true
      },
      {
        "name": "Validator",
        "type": "trait",
        "line": 25,
        "exported": true
      },
      {
        "name": "Status",
        "type": "enum",
        "line": 32,
        "exported": true
      },
      {
        "name": "Priority",
        "type": "enum",
        "line": 40,
        "exported": true
      },
      {
        "name": "User",
        "type": "struct",
        "line": 49,
        "exported": true
      },
      {
        "name": "Item",
        "type": "struct",
        "line": 57,
        "exported": true
      },
      {
        "name": "UserService",
        "type": "struct",
        "line": 64,
        "exported": true
      },
      {
        "name": "new",
        "type": "method",
        "line": 72,
        "exported": true,
        "parent": "UserService<R>",
        "signature": "(repo: R) -> Self"
      },
      {
        "name": "find_by_id",
        "type": "method",
        "line": 76,
        "exported": true,
        "parent": "UserService<R>",
        "signature": "(&self, id: &str) -> Option<User>"
      },
      {
        "name": "create",
        "type": "method",
        "line": 80,
        "exported": true,
        "parent": "UserService<R>",
        "signature": "(&mut self, user: &User) -> Result<(), Error>"
      },
      {
        "name": "new",
        "type": "function",
        "line": 72,
        "exported": true,
        "signature": "(repo: R) -> Self"
      },
      {
        "name": "find_by_id",
        "type": "function",
        "line": 76,
        "exported": true,
        "signature": "(&self, id: &str) -> Option<User>"
      },
      {
        "name": "create",
        "type": "function",
        "line": 80,
        "exported": true,
        "signature": "(&mut self, user: &User) -> Result<(), Error>"
      },
      {
        "name": "new",
        "type": "method",
        "line": 87,
        "exported": true,
        "parent": "Item",
        "signature": "(id: String, name: String, value: i32) -> Self"
      },
      {
        "name": "is_valid",
        "type": "method",
        "line": 91,
        "exported": true,
        "parent": "Item",
        "signature": "(&self) -> bool"
      },
      {
        "name": "new",
        "type": "function",
        "line": 87,
        "exported": true,
        "signature": "(id: String, name: String, value: i32) -> Self"
      },
      {
        "name": "is_valid",
        "type": "function",
        "line": 91,
        "exported": true,
        "signature": "(&self) -> bool"
      },
      {
        "name": "validate_email",
        "type": "function",
        "line": 98,
        "exported": true,
        "signature": "(email: &str) -> bool"
      },
      {
        "name": "format_user",
        "type": "function",
        "line": 103,
        "exported": true,
        "signature": "(user: &User) -> String"
      },
      {
        "name": "fetch_user",
        "type": "function",
        "line": 108,
        "exported": true,
        "signature": "(id: &str) -> Result<User, Error>"
      },
      {
        "name": "utils",
        "type": "module",
        "line": 115,
        "exported": true
      },
      {
        "name": "helper",
        "type": "function",
        "line": 116,
        "exported": true,
        "signature": "() -> bool"
      },
      {
        "name": "internal",
        "type": "module",
        "line": 121,
        "exported": false
      },
      {
        "name": "private_helper",
        "type": "function",
        "line": 122,
        "exported": true,
        "signature": "()"
      },
      {
        "name": "log_info",
        "type": "macro",
        "line": 128,
        "exported": true
      },
      {
        "name": "Cache",
        "type": "struct",
        "line": 136,
        "exported": true
      },
      {
        "name": "Error",
        "type": "struct",
        "line": 137,
        "exported": true
      }
    ]
  }
}